<?xml version="1.0" ?>
<!DOCTYPE preferences SYSTEM "chrome://guiconfig/locale/options.dtd">
<preferences xmlns="http://guiconfig.freedig.org/preferences"
             xmlns:xsi="http://www.w3.org/2001/XMLSchema-instance"
             xsi:schemaLocation="http://guiconfig.freedig.org/preferences preferences.xsd">
  <category label="&accessibility;" icon="accessibility">
    <concerns>
      <concern label="&mousebehaviour;">
        <concerns>
          <concern label="&mouseclick;">
            <group label="&middleclick;">
              <pref key="middlemouse.contentLoadURL"
                    label="&middlemouse_contentLoadURL_name;"
                    description="&middlemouse_contentLoadURL_description;"
                    type="bool" />
              <pref key="middlemouse.paste"
                    label="&middlemouse_paste_name;"
                    description="&middlemouse_paste_description;"
                    type="bool" />
            </group>
            <group label="&urlbar;">
              <pref key="browser.urlbar.clickSelectsAll"
                    label="&browser_urlbar_clickSelectsAll_name;"
                    description="&browser_urlbar_clickSelectsAll_description;"
                    type="bool" />
              <pref key="browser.urlbar.doubleClickSelectsAll"
                    label="&browser_urlbar_doubleClickSelectsAll_name;"
                    description="&browser_urlbar_doubleClickSelectsAll_description;"
                    type="bool" />
            </group>
          </concern>
          <concern label="&mousescrollvertical;" minVersion="17.0b1">
            <group label="&mousescrollnone;">
              <pref key="mousewheel.default.action"
                    label="&mousewheel_action_name;"
                    description="&mousewheel_action_description;"
                    type="int"
                    mode="select">
                <option label="&mousewheel_action_o1;">0</option>
                <option label="&mousewheel_action_o2;">1</option>
                <option label="&mousewheel_action_o3;">2</option>
                <option label="&mousewheel_action_o4;">3</option>
              </pref>
            </group>
            <group label="&mousescrollshift;">
              <pref key="mousewheel.with_shift.action"
                    label="&mousewheel_action_name;"
                    description="&mousewheel_action_description;"
                    type="int"
                    mode="select">
                <option label="&mousewheel_action_o1;">0</option>
                <option label="&mousewheel_action_o2;">1</option>
                <option label="&mousewheel_action_o3;">2</option>
                <option label="&mousewheel_action_o4;">3</option>
              </pref>
            </group>
            <group label="&mousescrollstrg;">
              <pref key="mousewheel.with_control.action"
                    label="&mousewheel_action_name;"
                    description="&mousewheel_action_description;"
                    type="int"
                    mode="select">
                <option label="&mousewheel_action_o1;">0</option>
                <option label="&mousewheel_action_o2;">1</option>
                <option label="&mousewheel_action_o3;">2</option>
                <option label="&mousewheel_action_o4;">3</option>
              </pref>
            </group>
            <group label="&mousescrollalt;">
              <pref key="mousewheel.with_alt.action"
                    label="&mousewheel_action_name;"
                    description="&mousewheel_action_description;"
                    type="int"
                    mode="select">
                <option label="&mousewheel_action_o1;">0</option>
                <option label="&mousewheel_action_o2;">1</option>
                <option label="&mousewheel_action_o3;">2</option>
                <option label="&mousewheel_action_o4;">3</option>
              </pref>
            </group>
          </concern>
        </concerns>
      </concern>
      <concern label="&urlbar;" minVersion="3.0">
        <pref key="browser.urlbar.default.behavior"
              type="int"
              minVersion="3.5"
              maxVersion="35.*">
          <behavior>
            <override name="setValue">
            <![CDATA[
              var checkboxes = view.getElementsByTagName('checkbox');
              for(var i = 0, l = checkboxes.length, checkbox; i < l; i++) {
                checkbox = checkboxes[i];
                checkbox.checked = parseInt(value) & parseInt(checkbox.getAttribute('value'));
              }
            ]]>
            </override>
            <override name="getValue">
            <![CDATA[
              var bitmap = 0;
              var checkboxes = view.getElementsByTagName('checkbox');
              for(var i = 0, l = checkboxes.length, checkbox; i < l; i++) {
                checkbox = checkboxes[i];
                if(checkbox.checked) {
                  bitmap += parseInt(checkbox.getAttribute('value'));
                }
              }
              return bitmap;
            ]]>
            </override>
          </behavior>
          <view>
            <group label="&urlbar_restrict_name;">
              <checkbox label="&browser_urlbar_restrict_typed_name;"
                        description="&browser_urlbar_restrict_typed_description;"
                        value="32" />
              <checkbox label="&browser_urlbar_restrict_history_name;"
                        description="&browser_urlbar_restrict_history_description;"
                        value="1" />
              <checkbox label="&browser_urlbar_restrict_bookmark_name;"
                        description="&browser_urlbar_restrict_bookmark_description;"
                        value="2" />
              <checkbox label="&browser_urlbar_restrict_tag_name;"
                        description="&browser_urlbar_restrict_tag_description;"
                        value="4" />
            </group>
            <group label="&urlbar_match_name;">
              <checkbox label="&browser_urlbar_match_title_name;"
                        description="&browser_urlbar_match_title_description;"
                        value="8" />
              <checkbox label="&browser_urlbar_match_url_name;"
                        description="&browser_urlbar_match_url_description;"
                        value="16" />
            </group>
          </view>
        </pref>
        <pref key="browser.urlbar.suggest.history.onlyTyped"
              label="&browser_urlbar_restrict_typed_name;"
              description="&browser_urlbar_restrict_typed_description;"
              type="bool"
              minVersion="36" />
        <pref key="browser.urlbar.matchBehavior"
              label="&browser_urlbar_matchBehavior_name;"
              description="&browser_urlbar_matchBehavior_description;"
              type="int"
              mode="select">
          <option label="&browser_urlbar_matchBehavior_o1;">0</option>
          <option label="&browser_urlbar_matchBehavior_o2;">1</option>
          <option label="&browser_urlbar_matchBehavior_o3;">2</option>
          <option label="&browser_urlbar_matchBehavior_o4;" minVersion="3.0">3</option>
        </pref>
        <pref key="browser.urlbar.maxRichResults"
              label="&browser_urlbar_maxRichResults_name;"
              description="&browser_urlbar_maxRichResults_description;"
              type="int" />
        <pref key="browser.urlbar.autoFill"
              label="&browser_urlbar_autoFill_name;"
              description="&browser_urlbar_autoFill_description;"
              type="bool" />
        <pref key="browser.fixup.alternate.enabled"
              label="&browser_fixup_alternate_enabled_name;"
              description="&browser_fixup_alternate_enabled_description;"
              type="bool" />
        <pref key="browser.fixup.alternate.prefix"
              label="&browser_fixup_alternate_prefix_name;"
              description="&browser_fixup_alternate_prefix_description;"
              type="string"
              indent="indent">
          <dependency key="browser.fixup.alternate.enabled" equals="true" />
        </pref>
        <pref key="browser.fixup.alternate.suffix"
              label="&browser_fixup_alternate_suffix_name;"
              description="&browser_fixup_alternate_suffix_description;"
              type="string"
              indent="indent">
          <dependency key="browser.fixup.alternate.enabled" equals="true" />
        </pref>
      </concern>
      <concern label="&websites;">
        <group label="&accessibility_typeaheadfind_label;">
          <pref key="accessibility.typeaheadfind.casesensitive"
                label="&accessibility_typeaheadfind_casesensitive_name;"
                description="&accessibility_typeaheadfind_casesensitive_description;"
                type="int"
                mode="select"
                minVersion="3.0">
            <option label="&accessibility_typeaheadfind_casesensitive_o1;">-1</option>
            <option label="&accessibility_typeaheadfind_casesensitive_o2;">0</option>
            <option label="&accessibility_typeaheadfind_casesensitive_o3;">1</option>
          </pref>
          <pref key="accessibility.typeaheadfind.timeout"
                label="&accessibility_typeaheadfind_timeout_name;"
                description="&accessibility_typeaheadfind_timeout_description;"
                type="int" />
        </group>
        <group label="&misc;">
          <pref key="prompts.tab_modal.enabled"
                label="&prompts_tab_modal_enabled_name;"
                description="&prompts_tab_modal_enabled_description;"
                type="bool"
                minVersion="4.0" />
          <pref key="signon.autofillForms"
                label="&signon_prefillForms_name;"
                description="&signon_prefillForms_description;"
                type="bool"/>